Title,Takeaway,Authors,Year,Citations,Abstract,Study Type,Journal,Journal SJR Quartile,DOI,Consensus Link
"Integrative modeling of performance deterioration and maintenance effectiveness for infrastructure assets with missing condition data","This paper presents a novel approach that integrates deterioration and maintenance effectiveness modeling, enabling more accurate long-term performance predictions for infrastructure assets.","P. Lin, Xian-Xun Yuan, Edgar Tovilla",2019,34,"Deterioration modeling is an important analytical component in infrastructure asset management. It concerns the prediction of performance and remaining service life of assets of different designs under omnifarious working environments. For long‐term prediction, it also requires to characterize maintenance effectiveness because maintenance activities do not necessarily bring an asset to a completely renewed status. Deterioration modeling research has for decades been largely focusing on the modeling of the natural deterioration process per se, whereas the modeling of maintenance effectiveness is only a recent focus of investigation, mainly in pavement research. In practice, the asset conditions immediately before and after a given maintenance treatment both are not often known. This has made the modeling of maintenance effectiveness and long‐term deterioration prediction a challenging task. To bridge the gap, this paper presents a novel approach that integrates the modeling of deterioration and maintenance effectiveness into one process. The natural deterioration of asset performance is modeled as a continuous‐time Markov chain, whereas the effectiveness of a maintenance measure is modeled as a discrete‐time Markov chain. To account for missing condition data before and after the maintenance event, the paper also develops a robust statistical method based on Markov chain Monte Carlo simulation. A real‐life case study on a municipal sewer pipe system is carried out for demonstration of the proposed integrated modeling approach. The functional deterioration of sewer pipes and the effectiveness of flushing operations that target to bring flow capacity to intact state are modeled. Influences of pipe length, diameter, slope, and sewershed area are examined. The present work is a valuable step toward development of evidence‐based risk‐informed asset management framework.","","Computer‐Aided Civil and Infrastructure Engineering","","10.1111/mice.12452","https://consensus.app/papers/integrative-modeling-of-performance-deterioration-and-lin-yuan/f3d25418e36550cdb83baa7b0ff0b9b9/"
"Automated Processing of eXplainable Artificial Intelligence Outputs in Deep Learning Models for Fault Diagnostics of Large Infrastructures","The proposed framework improves fault diagnosis accuracy in large infrastructure by 8% and reduces maintenance workload by 15%, while identifying anomalous explanations in images.","G. Floreale, P. Baraldi, Enrico Zio, Olga Fink",2025,2,"","","Eng. Appl. Artif. Intell.","1","10.1016/j.engappai.2025.110518","https://consensus.app/papers/automated-processing-of-explainable-artificial-floreale-baraldi/267003d5e87d50379baf33599bddbe92/"
"Black-box error diagnosis in Deep Neural Networks for computer vision: a survey of tools","This paper surveys tools for black-box performance diagnosis in Deep Neural Networks for computer vision, highlighting features and gaps in current proposals.","P. Fraternali, Federico Milani, Rocio Nahime Torres, Niccolò Zangrando",2022,12,"The application of Deep Neural Networks (DNNs) to a broad variety of tasks demands methods for coping with the complex and opaque nature of these architectures. When a gold standard is available, performance assessment treats the DNN as a black box and computes standard metrics based on the comparison of the predictions with the ground truth. A deeper understanding of performances requires going beyond such evaluation metrics to diagnose the model behavior and the prediction errors. This goal can be pursued in two complementary ways. On one side, model interpretation techniques “open the box” and assess the relationship between the input, the inner layers and the output, so as to identify the architecture modules most likely to cause the performance loss. On the other hand, black-box error diagnosis techniques study the correlation between the model response and some properties of the input not used for training, so as to identify the features of the inputs that make the model fail. Both approaches give hints on how to improve the architecture and/or the training process. This paper focuses on the application of DNNs to computer vision (CV) tasks and presents a survey of the tools that support the black-box performance diagnosis paradigm. It illustrates the features and gaps of the current proposals, discusses the relevant research directions and provides a brief overview of the diagnosis tools in sectors other than CV.","","Neural Computing and Applications","1","10.1007/s00521-022-08100-9","https://consensus.app/papers/blackbox-error-diagnosis-in-deep-neural-networks-for-fraternali-milani/c9e48f4f16045d419abff185c3a8fbe6/"
"Physics-informed neural network for lithium-ion battery degradation stable modeling and prognosis","The physics-informed neural network (PINN) accurately estimates lithium-ion battery state-of-health, demonstrating remarkable performance in various experiments and conditions compared to alternative neural networks.","Fujin Wang, Zhi Zhai, Zhibin Zhao, Yi Di, Xuefeng Chen",2024,375,"","","Nature Communications","1","10.1038/s41467-024-48779-z","https://consensus.app/papers/physicsinformed-neural-network-for-lithiumion-battery-wang-zhai/4e924851eae25258aefec213cdd896fa/"
"Leveraging Incremental Machine Learning for Reconfigurable Systems Modeling under Dynamic Workloads","Incremental machine learning models can improve run-time power consumption and performance estimations in FPGA-based reconfigurable systems under dynamic workloads, with low-overhead updates and superior adaptability.","Juan Encinas, Alfonso Rodríguez, Andrés Otero",2025,0,"Dynamic workload orchestration is one of the main concerns when working with heterogeneous computing infrastructures in the edge-cloud continuum. In this context, FPGA-based computing nodes can take advantage of their improved flexibility, performance, and energy efficiency provided that they use proper resource management strategies. In this regard, many state-of-the-art systems rely on proactive power management techniques and task scheduling decisions, which in turn require deep knowledge about the applications to be accelerated and the actual response of the target reconfigurable fabrics when executing them. While acquiring this knowledge at design time was more or less feasible in the past, with applications mostly being static task graphs that did not change at run time, the highly dynamic nature of current workloads in the edge-cloud continuum, where tasks can be deployed on any node and at any time, has removed this possibility. As a result, being able to derive such information at run time to make informed decisions has become a must. This article presents an infrastructure to build incremental ML models that can be used to obtain run-time power consumption and performance estimations in FPGA-based reconfigurable multi-accelerator systems operating under dynamic workloads. The proposed infrastructure features a novel stop-and-restart resource-aware mechanism to monitor and control the model training and evaluation stages during normal system operation, enabling low-overhead updates in the models to account for either unexpected acceleration requests (i.e., tasks not considered previously by the models) or model drift (e.g., fabric degradation). Experimental results show that the proposed approach induces a maximal additional error of 3.66% compared to a continuous training alternative. Furthermore, the proposed approach incurs only a 4.49% execution time overhead, compared to the 20.91% overhead induced by the continuous training alternative. The proposed modeling strategy enables innovative scheduling approaches in reconfigurable systems. This is exemplified by the conflict-aware scheduler introduced in this work, which achieves up to a 1.35 times speedup in executing the experimental workload. Additionally, the proposed approach demonstrates superior adaptability compared to other methods in the literature, particularly in response to significant changes in workload and to mitigate the effects of model overfitting. The portability of the proposed modeling methodology and monitoring infrastructure is also shown through their application to both Zynq-7000 and Zynq UltraScale+ devices.","","ACM Transactions on Reconfigurable Technology and Systems","1","10.1145/3715154","https://consensus.app/papers/leveraging-incremental-machine-learning-for-encinas-rodr%C3%ADguez/14ad7db507375d42ad4451b49fa5e288/"
